[
  {
    "question_id": "testing_001",
    "company": "通用",
    "position": "testing_engineering",
    "difficulty": "easy",
    "question_type": "single_choice",
    "content": "软件测试的主要目的是什么？",
    "options": [
      {
        "key": "A",
        "text": "发现缺陷、评估质量并降低软件风险"
      },
      {
        "key": "B",
        "text": "证明软件绝对不存在缺陷"
      },
      {
        "key": "C",
        "text": "完全替代需求分析和软件开发"
      },
      {
        "key": "D",
        "text": "只检查页面颜色是否正确"
      }
    ],
    "answer": "A",
    "knowledge_points": [
      "测试基础",
      "测试目标",
      "质量风险"
    ],
    "explanation": "软件测试用于发现缺陷、验证需求、评估产品质量并向项目决策提供信息，但有限的测试不能证明软件绝对没有缺陷。",
    "source": "ISTQB测试基础整理",
    "source_url": "https://www.istqb.org/certifications/certified-tester-foundation-level",
    "license": "reference-only"
  },
  {
    "question_id": "testing_002",
    "company": "通用",
    "position": "testing_engineering",
    "difficulty": "easy",
    "question_type": "single_choice",
    "content": "等价类划分方法的主要思想是什么？",
    "options": [
      {
        "key": "A",
        "text": "将输入划分为若干具有相似处理结果的集合，并从每个集合选择代表数据"
      },
      {
        "key": "B",
        "text": "测试所有可能的输入组合"
      },
      {
        "key": "C",
        "text": "只测试输入范围的最大值"
      },
      {
        "key": "D",
        "text": "只根据开发人员的代码编写测试"
      }
    ],
    "answer": "A",
    "knowledge_points": [
      "测试设计",
      "等价类划分",
      "黑盒测试"
    ],
    "explanation": "等价类划分将输入域划分为有效等价类和无效等价类，从每类选择代表值进行测试，以减少重复用例。",
    "source": "ISTQB测试设计技术整理",
    "source_url": "https://glossary.istqb.org/",
    "license": "reference-only"
  },
  {
    "question_id": "testing_003",
    "company": "通用",
    "position": "testing_engineering",
    "difficulty": "medium",
    "question_type": "single_choice",
    "content": "某输入框只允许输入1到100之间的整数。使用边界值分析时，以下哪组测试数据更合适？",
    "options": [
      {
        "key": "A",
        "text": "0、1、2、99、100、101"
      },
      {
        "key": "B",
        "text": "20、40、60、80"
      },
      {
        "key": "C",
        "text": "1、50、100"
      },
      {
        "key": "D",
        "text": "10、20、30"
      }
    ],
    "answer": "A",
    "knowledge_points": [
      "测试设计",
      "边界值分析",
      "输入校验"
    ],
    "explanation": "边界值分析通常检查边界本身、边界附近以及边界之外的数据。对于1到100，应重点测试0、1、2和99、100、101。",
    "source": "ISTQB测试设计技术整理",
    "source_url": "https://glossary.istqb.org/",
    "license": "reference-only"
  },
  {
    "question_id": "testing_004",
    "company": "通用",
    "position": "testing_engineering",
    "difficulty": "medium",
    "question_type": "single_choice",
    "content": "软件功能修改完成后，重新执行已有测试以确认原有功能未被破坏，这属于什么测试？",
    "options": [
      {
        "key": "A",
        "text": "回归测试"
      },
      {
        "key": "B",
        "text": "探索性测试"
      },
      {
        "key": "C",
        "text": "安装测试"
      },
      {
        "key": "D",
        "text": "可用性测试"
      }
    ],
    "answer": "A",
    "knowledge_points": [
      "回归测试",
      "软件变更",
      "测试类型"
    ],
    "explanation": "回归测试用于确认代码、配置或环境发生变化后，之前正常工作的功能没有受到意外影响。",
    "source": "ISTQB测试基础整理",
    "source_url": "https://glossary.istqb.org/",
    "license": "reference-only"
  },
  {
    "question_id": "testing_005",
    "company": "通用",
    "position": "testing_engineering",
    "difficulty": "medium",
    "question_type": "single_choice",
    "content": "黑盒测试最主要关注什么？",
    "options": [
      {
        "key": "A",
        "text": "系统输入、输出和外部行为是否符合需求"
      },
      {
        "key": "B",
        "text": "代码内部每一行的具体实现"
      },
      {
        "key": "C",
        "text": "开发人员使用的编辑器"
      },
      {
        "key": "D",
        "text": "服务器机房的装修情况"
      }
    ],
    "answer": "A",
    "knowledge_points": [
      "黑盒测试",
      "功能测试",
      "需求验证"
    ],
    "explanation": "黑盒测试根据需求和接口验证系统外部行为，不要求测试人员了解内部代码实现。等价类、边界值和判定表都是常见黑盒测试技术。",
    "source": "ISTQB测试设计技术整理",
    "source_url": "https://glossary.istqb.org/",
    "license": "reference-only"
  },
  {
    "question_id": "testing_006",
    "company": "通用",
    "position": "testing_engineering",
    "difficulty": "medium",
    "question_type": "multiple_choice",
    "content": "一条较完整的测试用例通常应包含哪些内容？",
    "options": [
      {
        "key": "A",
        "text": "测试前置条件和测试数据"
      },
      {
        "key": "B",
        "text": "操作步骤"
      },
      {
        "key": "C",
        "text": "预期结果"
      },
      {
        "key": "D",
        "text": "只写测试用例标题，不需要其他信息"
      }
    ],
    "answer": [
      "A",
      "B",
      "C"
    ],
    "knowledge_points": [
      "测试用例",
      "测试步骤",
      "预期结果"
    ],
    "explanation": "测试用例通常需要明确前置条件、输入数据、执行步骤和预期结果，以便执行人员能够重复测试并准确判断是否通过。",
    "source": "软件测试工程实践整理",
    "source_url": "https://www.istqb.org/certifications/certified-tester-foundation-level",
    "license": "reference-only"
  },
  {
    "question_id": "testing_007",
    "company": "通用",
    "position": "testing_engineering",
    "difficulty": "hard",
    "question_type": "multiple_choice",
    "content": "以下哪些属于常见的黑盒测试设计方法？",
    "options": [
      {
        "key": "A",
        "text": "等价类划分"
      },
      {
        "key": "B",
        "text": "边界值分析"
      },
      {
        "key": "C",
        "text": "判定表测试"
      },
      {
        "key": "D",
        "text": "统计代码行数"
      }
    ],
    "answer": [
      "A",
      "B",
      "C"
    ],
    "knowledge_points": [
      "黑盒测试",
      "等价类",
      "边界值",
      "判定表"
    ],
    "explanation": "等价类、边界值和判定表都属于基于规格说明的黑盒测试技术，分别适用于输入分类、边界缺陷和复杂条件组合等场景。",
    "source": "ISTQB测试设计技术整理",
    "source_url": "https://glossary.istqb.org/",
    "license": "reference-only"
  },
  {
    "question_id": "testing_008",
    "company": "通用",
    "position": "testing_engineering",
    "difficulty": "medium",
    "question_type": "true_false",
    "content": "由于输入和执行路径组合通常非常多，对复杂软件进行穷尽测试一般是不现实的。",
    "options": [],
    "answer": "true",
    "knowledge_points": [
      "测试原则",
      "穷尽测试",
      "风险测试"
    ],
    "explanation": "除非常简单的系统外，测试所有输入、状态和执行路径通常需要不可接受的时间和成本，因此应基于风险和优先级选择测试范围。",
    "source": "ISTQB测试原则整理",
    "source_url": "https://www.istqb.org/certifications/certified-tester-foundation-level",
    "license": "reference-only"
  },
  {
    "question_id": "testing_009",
    "company": "通用",
    "position": "testing_engineering",
    "difficulty": "medium",
    "question_type": "true_false",
    "content": "只要现有测试用例全部通过，就能够证明软件中不存在任何缺陷。",
    "options": [],
    "answer": "false",
    "knowledge_points": [
      "测试原则",
      "缺陷",
      "测试覆盖"
    ],
    "explanation": "测试通过只能说明在当前测试数据、环境和覆盖范围内没有发现对应问题，不能证明未覆盖区域或未知场景中不存在缺陷。",
    "source": "ISTQB测试原则整理",
    "source_url": "https://www.istqb.org/certifications/certified-tester-foundation-level",
    "license": "reference-only"
  },
  {
    "question_id": "testing_010",
    "company": "通用",
    "position": "testing_engineering",
    "difficulty": "hard",
    "question_type": "short_answer",
    "content": "缺陷严重程度和缺陷优先级有什么区别？",
    "options": [],
    "answer": "严重程度描述缺陷对系统功能、数据、安全或用户使用造成的影响大小，通常从技术和质量角度判断；优先级表示缺陷应当多快被修复，通常结合严重程度、用户范围、业务价值、发布时间和修复成本确定。严重缺陷通常具有较高优先级，但二者并不总是完全一致。",
    "knowledge_points": [
      "缺陷管理",
      "严重程度",
      "优先级"
    ],
    "explanation": "例如首页文字错误的技术影响较小，但在重大活动前可能需要优先修复；而某个极少触发的严重问题，也可能因为暂无发布风险而安排在后续版本处理。",
    "source": "缺陷管理实践整理",
    "source_url": "https://glossary.istqb.org/",
    "license": "reference-only"
  },
  {
    "question_id": "testing_011",
    "company": "通用",
    "position": "testing_engineering",
    "difficulty": "medium",
    "question_type": "single_choice",
    "content": "接口返回HTTP状态码401通常表示什么？",
    "options": [
      {
        "key": "A",
        "text": "请求缺少有效的身份认证信息"
      },
      {
        "key": "B",
        "text": "服务器永久删除了资源"
      },
      {
        "key": "C",
        "text": "请求一定已经成功执行"
      },
      {
        "key": "D",
        "text": "服务器发生数据库死锁"
      }
    ],
    "answer": "A",
    "knowledge_points": [
      "接口测试",
      "HTTP状态码",
      "身份认证"
    ],
    "explanation": "401表示请求缺少有效的身份认证凭证，或者凭证无效。403通常表示服务器理解请求，但拒绝授权访问。",
    "source": "HTTP接口测试资料整理",
    "source_url": "https://developer.mozilla.org/zh-CN/docs/Web/HTTP/Status/401",
    "license": "reference-only"
  },
  {
    "question_id": "testing_012",
    "company": "通用",
    "position": "testing_engineering",
    "difficulty": "medium",
    "question_type": "single_choice",
    "content": "按照HTTP语义，以下哪种请求方法通常是幂等的？",
    "options": [
      {
        "key": "A",
        "text": "GET"
      },
      {
        "key": "B",
        "text": "POST"
      },
      {
        "key": "C",
        "text": "CONNECT"
      },
      {
        "key": "D",
        "text": "PATCH一定幂等"
      }
    ],
    "answer": "A",
    "knowledge_points": [
      "接口测试",
      "HTTP方法",
      "幂等性"
    ],
    "explanation": "GET在HTTP语义上是安全且幂等的方法，多次执行相同GET请求不应产生额外业务副作用。POST通常不保证幂等，PATCH是否幂等取决于具体实现。",
    "source": "HTTP规范整理",
    "source_url": "https://www.rfc-editor.org/rfc/rfc9110.html",
    "license": "reference-only"
  },
  {
    "question_id": "testing_013",
    "company": "通用",
    "position": "testing_engineering",
    "difficulty": "medium",
    "question_type": "single_choice",
    "content": "以下哪类测试场景通常更适合优先进行自动化？",
    "options": [
      {
        "key": "A",
        "text": "执行频率高、步骤稳定、结果可明确断言的回归测试"
      },
      {
        "key": "B",
        "text": "需求每天大幅变化且无法确定预期结果的测试"
      },
      {
        "key": "C",
        "text": "只执行一次且自动化成本远高于人工成本的测试"
      },
      {
        "key": "D",
        "text": "完全依赖主观感受的界面美观评价"
      }
    ],
    "answer": "A",
    "knowledge_points": [
      "自动化测试",
      "回归测试",
      "自动化适用场景"
    ],
    "explanation": "稳定、重复执行频率高、业务价值高且结果容易断言的测试更适合自动化。变化频繁或高度依赖主观判断的场景通常需要谨慎评估。",
    "source": "自动化测试实践整理",
    "source_url": "https://www.selenium.dev/documentation/test_practices/",
    "license": "reference-only"
  },
  {
    "question_id": "testing_014",
    "company": "通用",
    "position": "testing_engineering",
    "difficulty": "hard",
    "question_type": "multiple_choice",